{
  "$schema": "https://json-schema.org/draft/2020-12/schema",
  "$id": "https://schemas.harness.invalid/topology.schema.json",
  "title": "drogna broker topology",
  "description": "Who may say what to whom on the broker, and where the tree says it. Derived from the repository by scripts/derive-topology.ts and written to contracts/topology.json, which is generated and gated: scripts/gates/check-topology-drift.ts fails when the committed instance no longer matches a fresh scan, for the same reason the generated type trees have a drift check. Two layers, and they are deliberately not the same thing. The publishers and subscribers of a topic are permissions, read in V2 from the broker component’s configured role rules, which the broker enforces and which are therefore the complete statement of the boundary (E14: the scanner reads component configuration, never a hand-maintained file); they are coarse wherever that file is coarse, and the control role's readwrite over the whole control namespace is the coarsest place. What narrows them is named_by, the places in the tree that actually name the topic. Neither layer is a claim about a running system: nothing here says a component exists, is alive, or has ever sent anything, and a display built on it must light a cell from received traffic and never from this document (Constitution VII).",
  "type": "object",
  "required": ["generator", "roles", "components", "topics"],
  "additionalProperties": false,
  "properties": {
    "generator": {
      "type": "string",
      "description": "The repository-relative script that writes this document. Recorded so a reader who finds the file first can find the derivation second. No version and no time of generation: a document that carried either would differ on every run and the drift gate would report a change nobody made."
    },
    "roles": {
      "type": "array",
      "description": "The broker roles, and what the access control list grants each. Roles are per role and not per client instance, so ten sensors share one and adding a sensor grants nothing new.",
      "items": { "$ref": "#/$defs/broker_role" }
    },
    "components": {
      "type": "array",
      "description": "The components that hold a broker identity, and the role each authenticates as. Read from the destination configurations, which is where a component's role is written down and is what the broker actually authenticates. A component with no broker section is absent from this list, which is a fact about it rather than an omission.",
      "items": { "$ref": "#/$defs/component_identity" }
    },
    "topics": {
      "type": "array",
      "description": "Every topic or topic filter the harness uses, sorted by name.",
      "items": { "$ref": "#/$defs/topic_entry" }
    }
  },
  "$defs": {
    "broker_role": {
      "type": "object",
      "description": "One authenticated identity at the broker, and its rules.",
      "required": ["role", "rules"],
      "additionalProperties": false,
      "properties": {
        "role": {
          "type": "string",
          "pattern": "^[a-z][a-z0-9_-]*$",
          "description": "The user name in the access control list. The password that authenticates it is produced at deploy time, appears in no tracked file, and is not read by the scanner."
        },
        "rules": {
          "type": "array",
          "description": "The role's rules in the order the access control list states them. Mosquitto denies by default, so an absent rule is a refusal rather than a gap.",
          "items": { "$ref": "#/$defs/access_rule" }
        }
      }
    },
    "access_rule": {
      "type": "object",
      "description": "One line of the access control list: a direction and the topic filter it applies to.",
      "required": ["access", "filter"],
      "additionalProperties": false,
      "properties": {
        "access": {
          "type": "string",
          "enum": ["read", "write", "readwrite"],
          "description": "read is subscribe, write is publish, readwrite is both. The spelling is mosquitto's."
        },
        "filter": {
          "type": "string",
          "description": "An MQTT topic filter, which may carry the single-level wildcard + or the multi-level wildcard #."
        }
      }
    },
    "component_identity": {
      "type": "object",
      "description": "A component and the broker role it presents.",
      "required": ["id", "role", "source_root"],
      "additionalProperties": false,
      "properties": {
        "id": {
          "type": "string",
          "pattern": "^[a-z][a-z0-9_-]*$",
          "description": "The component id, as its configuration declares it and as its heartbeat carries it."
        },
        "role": {
          "type": "string",
          "pattern": "^[a-z][a-z0-9_-]*$",
          "description": "The role named in the component's broker URL. Both destinations are read and are required to agree; a disagreement stops the scan rather than being resolved in favour of one."
        },
        "source_root": {
          "type": ["string", "null"],
          "description": "The repository-relative directory holding this component's own source, which is what the scan walks for the topics it names. Null where the component has no source tree of its own."
        }
      }
    },
    "topic_entry": {
      "type": "object",
      "description": "One topic, its governing shape, who may speak on it, and where the tree names it.",
      "required": ["topic", "namespace", "schema", "publishers", "subscribers", "named_by"],
      "additionalProperties": false,
      "properties": {
        "topic": {
          "type": "string",
          "description": "The topic or filter. A component that names a branch prefix and a component that names the branch filter mean the same branch, and both are recorded here in the filter's spelling."
        },
        "namespace": {
          "type": "string",
          "enum": ["obs", "ctl", "cov", "adv"],
          "description": "The two namespaces are conventions of the harness rather than configuration: obs carries observations, ctl carries control events, and the access control list is what makes the separation a control rather than a custom."
        },
        "schema": {
          "type": ["string", "null"],
          "description": "The repository-relative master that governs payloads on this topic, resolved by the repository layout's naming convention. Null where no master claims the topic, which is a finding for a reader rather than a permitted state for a message."
        },
        "publishers": {
          "type": "array",
          "description": "The components whose role the access control list permits to publish here. A permission, not an observation: it says the broker would accept the message, not that anything sends one. Where the list grants a whole namespace, every component holding that role appears.",
          "items": { "type": "string", "pattern": "^[a-z][a-z0-9_-]*$" }
        },
        "subscribers": {
          "type": "array",
          "description": "The components whose role the access control list permits to subscribe here, read the same way as publishers.",
          "items": { "type": "string", "pattern": "^[a-z][a-z0-9_-]*$" }
        },
        "named_by": {
          "type": "array",
          "description": "Every place in the tree that names this topic, with the component the source belongs to. This is the narrowing the access control list does not enforce: nine components may publish a run request and one names it. A site in a shared library carries a null component, because a library publishes on behalf of whoever calls it and guessing which components those are would be an unchecked claim of exactly the kind this artefact exists to abolish.",
          "items": { "$ref": "#/$defs/source_site" }
        }
      }
    },
    "source_site": {
      "type": "object",
      "description": "One place in the tree that names a topic.",
      "required": ["component", "path", "line", "constant"],
      "additionalProperties": false,
      "properties": {
        "component": {
          "type": ["string", "null"],
          "description": "The component whose source tree this site is in, or null for a shared library."
        },
        "path": {
          "type": "string",
          "description": "Repository-relative path of the file holding the declaration."
        },
        "line": {
          "type": "integer",
          "minimum": 1,
          "description": "The line the declaration is on, so a reader can open it."
        },
        "constant": {
          "type": "string",
          "description": "The name the declaration binds the topic to."
        }
      }
    }
  },
  "examples": [
    {
      "generator": "scripts/derive-topology.ts",
      "roles": [
        { "role": "drogna_sensor", "rules": [{ "access": "write", "filter": "obs/#" }] }
      ],
      "components": [
        { "id": "sensors", "role": "drogna_sensor", "source_root": "services/sensors" }
      ],
      "topics": [
        {
          "topic": "obs/#",
          "namespace": "obs",
          "schema": "contracts/schemas/observation.schema.json",
          "publishers": ["sensors"],
          "subscribers": [],
          "named_by": [
            {
              "component": "sensors",
              "path": "services/sensors/src/harness_sensors/publisher.py",
              "line": 34,
              "constant": "OBSERVATION_BRANCH"
            }
          ]
        }
      ]
    }
  ]
}
