{
  "generator": "scripts/derive-topology.ts",
  "roles": [
    {
      "role": "clock",
      "rules": [
        {
          "access": "write",
          "filter": "ctl/clock"
        },
        {
          "access": "write",
          "filter": "ctl/heartbeat"
        }
      ]
    },
    {
      "role": "broker",
      "rules": [
        {
          "access": "write",
          "filter": "ctl/heartbeat"
        },
        {
          "access": "read",
          "filter": "ctl/clock"
        }
      ]
    },
    {
      "role": "boundary",
      "rules": [
        {
          "access": "write",
          "filter": "ctl/boundary/denial"
        },
        {
          "access": "write",
          "filter": "ctl/heartbeat"
        },
        {
          "access": "read",
          "filter": "ctl/clock"
        }
      ]
    },
    {
      "role": "env-generator",
      "rules": [
        {
          "access": "write",
          "filter": "ctl/heartbeat"
        },
        {
          "access": "read",
          "filter": "ctl/clock"
        }
      ]
    },
    {
      "role": "sensors",
      "rules": [
        {
          "access": "write",
          "filter": "obs/+/+"
        },
        {
          "access": "write",
          "filter": "ctl/heartbeat"
        },
        {
          "access": "read",
          "filter": "ctl/clock"
        }
      ]
    },
    {
      "role": "ingest",
      "rules": [
        {
          "access": "write",
          "filter": "ctl/heartbeat"
        },
        {
          "access": "read",
          "filter": "obs/#"
        },
        {
          "access": "read",
          "filter": "ctl/clock"
        }
      ]
    },
    {
      "role": "feature-store",
      "rules": [
        {
          "access": "write",
          "filter": "ctl/heartbeat"
        },
        {
          "access": "read",
          "filter": "ctl/clock"
        }
      ]
    },
    {
      "role": "observation-store",
      "rules": [
        {
          "access": "write",
          "filter": "ctl/heartbeat"
        },
        {
          "access": "read",
          "filter": "ctl/clock"
        }
      ]
    },
    {
      "role": "query",
      "rules": [
        {
          "access": "write",
          "filter": "ctl/heartbeat"
        },
        {
          "access": "read",
          "filter": "ctl/clock"
        }
      ]
    },
    {
      "role": "monitor",
      "rules": [
        {
          "access": "write",
          "filter": "ctl/divergence"
        },
        {
          "access": "write",
          "filter": "ctl/telemetry"
        },
        {
          "access": "write",
          "filter": "ctl/heartbeat"
        },
        {
          "access": "read",
          "filter": "obs/#"
        },
        {
          "access": "read",
          "filter": "ctl/clock"
        }
      ]
    },
    {
      "role": "scheduler",
      "rules": [
        {
          "access": "write",
          "filter": "ctl/run/request"
        },
        {
          "access": "write",
          "filter": "ctl/telemetry"
        },
        {
          "access": "write",
          "filter": "ctl/heartbeat"
        },
        {
          "access": "read",
          "filter": "ctl/divergence"
        },
        {
          "access": "read",
          "filter": "ctl/run/published"
        },
        {
          "access": "read",
          "filter": "ctl/clock"
        }
      ]
    },
    {
      "role": "planner",
      "rules": [
        {
          "access": "write",
          "filter": "ctl/plan"
        },
        {
          "access": "write",
          "filter": "ctl/heartbeat"
        },
        {
          "access": "read",
          "filter": "obs/#"
        },
        {
          "access": "read",
          "filter": "ctl/run/published"
        },
        {
          "access": "read",
          "filter": "ctl/clock"
        }
      ]
    },
    {
      "role": "model-runner",
      "rules": [
        {
          "access": "write",
          "filter": "ctl/run/started"
        },
        {
          "access": "write",
          "filter": "ctl/run/published"
        },
        {
          "access": "write",
          "filter": "ctl/heartbeat"
        },
        {
          "access": "read",
          "filter": "ctl/run/request"
        },
        {
          "access": "read",
          "filter": "ctl/clock"
        }
      ]
    },
    {
      "role": "coverage-store",
      "rules": [
        {
          "access": "write",
          "filter": "cov/holdings"
        },
        {
          "access": "write",
          "filter": "ctl/heartbeat"
        },
        {
          "access": "read",
          "filter": "ctl/clock"
        }
      ]
    },
    {
      "role": "advisory-source",
      "rules": [
        {
          "access": "write",
          "filter": "adv/advisories"
        },
        {
          "access": "write",
          "filter": "ctl/heartbeat"
        },
        {
          "access": "read",
          "filter": "ctl/clock"
        }
      ]
    },
    {
      "role": "advisory-store",
      "rules": [
        {
          "access": "write",
          "filter": "ctl/heartbeat"
        },
        {
          "access": "read",
          "filter": "adv/advisories"
        },
        {
          "access": "read",
          "filter": "ctl/clock"
        }
      ]
    },
    {
      "role": "offload",
      "rules": [
        {
          "access": "write",
          "filter": "ctl/offload"
        },
        {
          "access": "write",
          "filter": "ctl/heartbeat"
        },
        {
          "access": "read",
          "filter": "ctl/run/published"
        },
        {
          "access": "read",
          "filter": "ctl/clock"
        }
      ]
    },
    {
      "role": "telemetry",
      "rules": [
        {
          "access": "write",
          "filter": "ctl/telemetry"
        },
        {
          "access": "write",
          "filter": "ctl/heartbeat"
        },
        {
          "access": "read",
          "filter": "ctl/telemetry"
        },
        {
          "access": "read",
          "filter": "ctl/run/published"
        },
        {
          "access": "read",
          "filter": "obs/#"
        },
        {
          "access": "read",
          "filter": "ctl/clock"
        }
      ]
    },
    {
      "role": "operator",
      "rules": [
        {
          "access": "write",
          "filter": "ctl/heartbeat"
        },
        {
          "access": "read",
          "filter": "ctl/heartbeat"
        },
        {
          "access": "read",
          "filter": "ctl/clock"
        }
      ]
    },
    {
      "role": "shell",
      "rules": [
        {
          "access": "read",
          "filter": "#"
        }
      ]
    }
  ],
  "components": [
    {
      "id": "advisory-source",
      "role": "advisory-source",
      "source_root": null
    },
    {
      "id": "advisory-store",
      "role": "advisory-store",
      "source_root": null
    },
    {
      "id": "boundary",
      "role": "boundary",
      "source_root": "app/src/backend/boundary"
    },
    {
      "id": "broker",
      "role": "broker",
      "source_root": "app/src/backend/broker"
    },
    {
      "id": "clock",
      "role": "clock",
      "source_root": "app/src/backend/clock"
    },
    {
      "id": "coverage-store",
      "role": "coverage-store",
      "source_root": "app/src/backend/coverage-store"
    },
    {
      "id": "env-generator",
      "role": "env-generator",
      "source_root": "app/src/backend/env-generator"
    },
    {
      "id": "feature-store",
      "role": "feature-store",
      "source_root": "app/src/backend/feature-store"
    },
    {
      "id": "ingest",
      "role": "ingest",
      "source_root": "app/src/backend/ingest"
    },
    {
      "id": "model-runner",
      "role": "model-runner",
      "source_root": "app/src/backend/model-runner"
    },
    {
      "id": "monitor",
      "role": "monitor",
      "source_root": "app/src/backend/monitor"
    },
    {
      "id": "observation-store",
      "role": "observation-store",
      "source_root": "app/src/backend/observation-store"
    },
    {
      "id": "offload",
      "role": "offload",
      "source_root": "app/src/backend/offload"
    },
    {
      "id": "operator",
      "role": "operator",
      "source_root": "app/src/backend/operator"
    },
    {
      "id": "planner",
      "role": "planner",
      "source_root": "app/src/backend/planner"
    },
    {
      "id": "query",
      "role": "query",
      "source_root": "app/src/backend/query"
    },
    {
      "id": "scheduler",
      "role": "scheduler",
      "source_root": "app/src/backend/scheduler"
    },
    {
      "id": "sensors",
      "role": "sensors",
      "source_root": "app/src/backend/sensors"
    },
    {
      "id": "shell",
      "role": "shell",
      "source_root": "app/src/shell"
    },
    {
      "id": "telemetry",
      "role": "telemetry",
      "source_root": "app/src/backend/telemetry"
    }
  ],
  "topics": [
    {
      "topic": "adv/advisories",
      "namespace": "adv",
      "schema": "contracts/schemas/advisory.schema.json",
      "publishers": [
        "advisory-source"
      ],
      "subscribers": [
        "advisory-store",
        "shell"
      ],
      "named_by": [
        {
          "component": "advisory-source",
          "path": "app/config/run.json",
          "line": 378,
          "constant": "/advisory_source/topics/advisory"
        },
        {
          "component": "advisory-store",
          "path": "app/config/run.json",
          "line": 378,
          "constant": "/advisory_store/topics/advisory"
        },
        {
          "component": "shell",
          "path": "app/config/run.json",
          "line": 468,
          "constant": "/shell/topics/advisories"
        }
      ]
    },
    {
      "topic": "cov/holdings",
      "namespace": "cov",